{
  "assertion_id": "deadline_exact",
  "type": "normalized_date_equal",
  "scorer_ref": "normalized_date_equal.v1",
  "observed_selector": "$.deadline.date",
  "expected": "2026-07-17",
  "params": {},
  "required": true,
  "weight": 2.0,
  "severity": "critical",
  "pass_threshold": 1.0,
  "evidence_requirement": {
    "type": "source_reference_required",
    "observed_selector": "$.deadline.evidence_refs"
  },
  "on_unevaluable": "fail"
}
